{
  "abiVersion": 1,
  "activationSetDefaultVersionCalldata": "0x9306456a0000000000000000000000000000000000000000000000000000000000000001",
  "activationSetDefaultVersionTarget": "0x8f9208FD358c62FB4052e4C2FBbCA3152A17E4b6",
  "activationSetRegistrarCalldata": "0xfaab9d390000000000000000000000008f9208fd358c62fb4052e4c2fbbca3152a17e4b6",
  "activationSetRegistrarTarget": "0x0B68fD82965Fd853907CA4E2f7E6E6d478Aaef8b",
  "chainId": 46630,
  "creationFeeUnits": 5000000,
  "deployer": "0x9352e25bCE67fE650BC8Ab7fBda5E92c36273E91",
  "emergencyRole": "0x7f4601752bd49155c47A943893Ddb13C9f1Aa446",
  "environment": "robinhood-testnet",
  "factoryImplementation": "0x7452C544995ca53Ae542d14679b9Cc11eD646481",
  "factoryImplementationCodeHash": "0x8a48e2e3b1a00c6772ffeaa8514def951f4faa21e14f3126b761dae921e85976",
  "factoryProxy": "0x8f9208FD358c62FB4052e4C2FBbCA3152A17E4b6",
  "factoryProxyCodeHash": "0x4c0e1a9cf43432c5223b2232a57b05ded583ec22890fecfe6e59720af9128d31",
  "feeVault": "0x82D9159cB488175cAcdcD145A7285d80563e69d0",
  "feeVaultCodeHash": "0xd44c69894099cf43d780365ec81db8721aded334bf8d81f5c61561c00ed55a41",
  "feeVaultVersion": 1,
  "governanceTimelock": "0xDD935c94d8433CF959d12Dd915bb3Cd0a245876B",
  "indexerStartBlock": 11612930,
  "manifestVersion": 1,
  "marketRegistry": "0x0B68fD82965Fd853907CA4E2f7E6E6d478Aaef8b",
  "marketRegistryCodeHash": "0x458eec5ef656bccd47714eb444a9d0f8a668fa0e7e574b74cea316d1b2625b38",
  "marketVaultImplementation": "0x532C6424877c9f73C5eBA6792F985555aF889A7a",
  "marketVaultImplementationCodeHash": "0x4f2e29b7be204dc3187ac149038d08d1c9f963e011a06dfd17df6bb18a794f91",
  "marketVersion": 1,
  "protocolTreasury": "0x786c860A8659b63Ebdf885a93a78282b2C80214b",
  "riskController": "0xfeebdbB42de39B95f8dE5FcdBDd11e986443c278",
  "riskControllerCodeHash": "0x5f74ae30ff85f61231e8ea43d4b668ad07f3239c0e5ad6ac0fd4b574a5e96377",
  "riskControllerVersion": 1,
  "settlementToken": "0xAc80194dc1aE8eF52df73e7e1864fB3C62290fe0",
  "settlementTokenRuntimeHash": "0xf45e11ddae86e83321f1f290f0e6e99f50dceb81d19b7edbf2bf1b1fbb0c9b5c",
  "sideTokenImplementation": "0xdfF5Ed954cFC2ba873539Ffbd093e072C3a38d9C",
  "sideTokenImplementationCodeHash": "0xb2d9a8e74440f672bccd50dde48706173d3daad300dc31c8a6174ffb2ff2f15a",
  "sourceCommit": "99de6f5bce367a6e54bf35ac385a5345b756f5b5",
  "status": "PENDING_GOVERNANCE_ACTIVATION",
  "teamTreasury": "0x6AE1c7B6c583E50777002b70FE289321f23B8fF3"
}